Name,Enunciado__c,Certificacao__c,DominioPrincipal__c,TopicoPrincipal__c,TipoQuestao__c,NivelDificuldade__c,ColecaoSimulado__c,NivelSimulado__c,OrigemSimulado__c,CodigoQuestao__c,Subtopico__c
"Simulado - SM011","Qual objeto representa o dado em seu estado bruto dentro do Data Cloud, mantendo o formato original da fonte de origem?","[CERT_ID]","[DOMINIO_ID]","[TOPICO_ID]","Simulado","Facil","Fundamentos Data Cloud",1,"Oficial (Fundamentos)","SM011","Ingestão de Dados"
"Simulado - SM012","No processo de mapeamento, para qual modelo padrão os Data Lake Objects (DLOs) devem ser direcionados para permitir a unificação dos perfis?","[CERT_ID]","[DOMINIO_ID]","[TOPICO_ID]","Simulado","Facil","Fundamentos Data Cloud",1,"Oficial (Fundamentos)","SM012","Modelagem e Harmonização"
"Simulado - SM013","Qual recurso é utilizado para consolidar múltiplos registros (como diferentes e-mails ou telefones) de fontes distintas em um perfil único de Unified Individual?","[CERT_ID]","[DOMINIO_ID]","[TOPICO_ID]","Simulado","Facil","Fundamentos Data Cloud",1,"Oficial (Fundamentos)","SM013","Resolução de Identidade"
"Simulado - SM014","Qual funcionalidade permite criar métricas complexas processadas em lote (batch), como o cálculo do Lifetime Value (LTV) de um cliente?","[CERT_ID]","[DOMINIO_ID]","[TOPICO_ID]","Simulado","Facil","Fundamentos Data Cloud",1,"Oficial (Fundamentos)","SM014","Inteligência de Dados"
"Simulado - SM015","Para onde os dados segmentados são enviados quando precisam ser utilizados em ferramentas externas, como o Marketing Cloud ou Amazon S3?","[CERT_ID]","[DOMINIO_ID]","[TOPICO_ID]","Simulado","Facil","Fundamentos Data Cloud",1,"Oficial (Fundamentos)","SM015","Ativação de Dados"
